{
  "$schema": "https://json-schema.org/draft/2020-12/schema",
  "$id": "https://github.com/unitcraft/crew-harness/src/machine/schema/scenario-0.schema.json",
  "title": "scenario/0 - events and what they must leave",
  "description": "A scenario of a machine: the events and, after every step, the expected state, structural journal (the lines the machine wrote), a subset of the data, the queue, the open requests, the requests sent and cancelled, the outcome. A part that is not named is not compared. The runner is src/machine_run/scenario.nv.",
  "type": "object",
  "additionalProperties": false,
  "required": ["format", "machine", "steps"],
  "properties": {
    "format": { "const": "scenario/0" },
    "machine": { "type": "string", "description": "the Latin name of the machine the scenario runs on" },
    "name": { "type": "string" },
    "start_at": { "type": "integer", "default": 1000, "description": "the clock of the in-memory world in milliseconds" },
    "params": { "type": "object", "description": "the table of the parameters of the project (format 2.7, P-9): the key `проект.<ключ>` of the column \"project override\" of a parameter and its value in the lossless JSON form of the core; a key the machine does not have refuses the run, a parameter that is not named keeps its default",
    "propertyNames": { "pattern": "^проект\\." } },
    "steps": { "type": "array", "items": { "$ref": "#/$defs/step" } }
  },
  "$defs": {
    "event": {
      "type": "object", "additionalProperties": false, "required": ["kind"],
      "properties": {
        "kind": { "enum": ["word", "signal", "progress", "answer", "failure", "timeout", "start"] },
        "name": { "type": "string", "description": "required for word, signal and progress; the defaults are answer, failure, timeout, start" },
        "request": { "type": "string", "description": "the id of the request the event answers (agent-1); for `start` the id of the request that started the machine (the request of the call)" },
        "input": { "type": ["string", "object"], "description": "the data of the event: a word or a signal with one field has the value of the field (a text, `\"ivan\"`, not an object), with several fields an object {field: value}, with none no input; the input of the start is an object (format 2.7, P-8)" },
        "code": { "type": "string", "description": "the failure code of a `failure` event (ModelRefused)" },
        "source": { "type": "string", "description": "the key of the source of the event: the engine acknowledges it after the commit" }
      }
    },
    "journal_entry": {
      "type": "object", "additionalProperties": false, "required": ["code"],
      "properties": { "code": { "type": "string" }, "params": { "type": "object", "additionalProperties": { "type": "string" } } }
    },
    "expect": {
      "type": "object", "additionalProperties": false,
      "properties": {
        "state": { "type": "string" },
        "journal": { "type": "array", "items": { "$ref": "#/$defs/journal_entry" } },
        "data": { "type": "object", "description": "the names of data and their values in the JSON form of the core" },
        "queue": { "type": "array", "items": { "type": "string" }, "description": "send <id> and cancel <id> that wait for the dispatch, in <name> that wait for the pump" },
        "open": { "type": "array", "items": { "type": "string" } },
        "outcome": { "type": "string", "description": "none, answer:<text> or refusal:<Code>" },
        "sent": { "type": "array", "items": { "type": "string" }, "description": "all the requests sent so far" },
        "cancelled": { "type": "array", "items": { "type": "string" }, "description": "all the requests cancelled so far" }
      }
    },
    "step": {
      "type": "object", "additionalProperties": false,
      "properties": {
        "do": { "enum": ["feed", "accept", "dispatch", "pump", "deliver", "advance", "restart"], "default": "feed" },
        "event": { "$ref": "#/$defs/event", "description": "required for feed, accept and deliver" },
        "ms": { "type": "integer", "minimum": 0, "description": "for advance" },
        "host": { "type": "object", "description": "answers of primitives of the host that hold from this step on: the name of the primitive and its value in the lossless JSON form of the core" },
        "expect": { "$ref": "#/$defs/expect", "description": "what the engine the step acts on must leave" },
        "on": { "type": "string", "description": "the id of the request of a nested machine (callee-1) that the step acts on; the parent when absent. The nested machines start when the parent sends their request, answer the parent when they end, get a signal for a signal of the parent and a cancel for a cancelled request (src/machine_run/nested.nv)" },
        "also": { "type": "object", "additionalProperties": { "$ref": "#/$defs/expect" }, "description": "what other engines must leave after the step: the key is `parent` or the id of the request of a nested machine" }
      }
    }
  }
}
