{
  "format": "scenario/0",
  "machine": "agent_step",
  "name": "POLICY 2: a call without a human (a lens) asks nothing: the answer is deny",
  "start_at": 1000,
  "steps": [
    {"do": "feed", "event": {"kind": "start", "request": "call-1", "input": {"agent_request": {"$record": "AgentRequest", "fields": {"kind": {"$variant": "CallerKind", "name": "Lens", "fields": {}}, "profile": {"$record": "AgentProfile", "fields": {"family": "claude", "model": "m1", "effort": null}}, "session": "s1", "dialog_kind": "main", "context": "ctx", "limits": {"$record": "AgentLimits", "fields": {"silence_term": null, "token_budget": null, "cost_budget": null, "turn_limit": null}}, "trace": "t1", "step": 0}}}}, "host": {"reply_validation": {"$variant": "ReplyCheck", "name": "Valid", "fields": {}}, "close_agent_turn": null}, "expect": {"state": "AgentTurn", "journal": [], "data": {"turn_count": 1, "started": 1000, "turn": "first", "agent_attempt": 1, "open_requests": ["agent-1"], "call_request_id": "call-1"}, "open": ["agent-1"], "sent": ["agent-1"]}},
    {"do": "feed", "event": {"kind": "answer", "name": "agent_done", "request": "agent-1", "input": {"$variant": "TurnResult", "name": "NeedsPermission", "fields": {"permission_request": {"$record": "PermissionRequest", "fields": {"action": {"$variant": "ActionKind", "name": "Read", "fields": {}}, "description": "d"}}}}}, "expect": {"state": "AgentTurn", "journal": [{"code": "permission_auto_denied", "params": {"action": "read"}}], "data": {"permission_decision": "deny", "turn": "permission"}, "sent": ["agent-1", "agent-2"]}}
  ]
}
