{
  "format": "scenario/0",
  "machine": "session_start",
  "name": "FLOW: the optional fields of the input are absent: they are none (the source is the empty text), the launch starts",
  "start_at": 1000,
  "steps": [
    {
      "do": "feed",
      "host": {
        "reply_validation": {
          "$variant": "ReplyCheck",
          "name": "Valid",
          "fields": {}
        },
        "close_agent_turn": null,
        "launch_scope": {
          "$variant": "LaunchScope",
          "name": "Fits",
          "fields": {}
        },
        "launch_profile": {
          "$record": "AgentProfile",
          "fields": {
            "family": "claude",
            "model": "m1",
            "effort": null
          }
        },
        "session_context": "the prompt of s1",
        "parse_session_artifact": {
          "$record": "SessionParsing",
          "fields": {
            "result": {
              "$variant": "SessionResult",
              "name": "Done",
              "fields": {}
            },
            "summary": null,
            "findings": null
          }
        },
        "stop_agent_group": null,
        "prepare_launch": null,
        "finish_launch": null
      },
      "event": {
        "kind": "start",
        "request": "up-1",
        "input": {
          "session": "s1",
          "task_dir": "/t",
          "repo_dir": "/r",
          "delivery_mode": "files",
          "route": "full",
          "delivery_short": false
        }
      },
      "expect": {
        "state": "Gate2",
        "journal": [],
        "open": [],
        "sent": [],
        "queue": [],
        "outcome": "none",
        "data": {
          "call_request_id": "up-1",
          "step_attempt": 0,
          "open_requests": [],
          "session": "s1",
          "stop_reason": "",
          "launch_source": "",
          "phase": null,
          "launch_pass": null,
          "source_list": null,
          "route": "full",
          "delivery_short": false
        }
      }
    }
  ]
}
