{
  "format": "scenario/0",
  "machine": "dialog_steps",
  "name": "a chat turn: the session is cancelled by its parent; the cancel goes down to the agent step and its reply is dropped",
  "start_at": 1000,
  "steps": [
    {
      "do": "feed",
      "host": {
        "reply_validation": {
          "$variant": "ReplyCheck",
          "name": "Valid",
          "fields": {}
        },
        "close_agent_turn": null
      },
      "event": {
        "kind": "start",
        "request": "up-1",
        "input": {
          "agent_request": {
            "$record": "AgentRequest",
            "fields": {
              "kind": {
                "$variant": "CallerKind",
                "name": "CycleSession",
                "fields": {}
              },
              "profile": {
                "$record": "AgentProfile",
                "fields": {
                  "family": "claude",
                  "model": "m1",
                  "effort": null
                }
              },
              "session": "s1",
              "dialog_kind": "main",
              "context": "ctx",
              "limits": {
                "$record": "AgentLimits",
                "fields": {
                  "silence_term": null,
                  "token_budget": null,
                  "cost_budget": null,
                  "turn_limit": null
                }
              },
              "trace": "t1",
              "step": 0
            }
          }
        }
      },
      "expect": {
        "state": "Turn",
        "open": [
          "call-1"
        ],
        "sent": [
          "call-1"
        ],
        "outcome": "none",
        "data": {
          "open_requests": [
            "call-1"
          ],
          "step_attempt": 1
        }
      },
      "also": {
        "call-1": {
          "state": "AgentTurn",
          "open": [
            "agent-1"
          ],
          "sent": [
            "agent-1"
          ],
          "data": {
            "call_request_id": "call-1",
            "open_requests": [
              "agent-1"
            ]
          }
        }
      }
    },
    {
      "do": "feed",
      "event": {
        "kind": "signal",
        "name": "cancel_request",
        "input": "up-1"
      },
      "expect": {
        "state": "Halted",
        "outcome": "refusal:Cancelled",
        "open": [],
        "cancelled": [
          "call-1"
        ]
      },
      "also": {
        "call-1": {
          "state": "Halted",
          "outcome": "refusal:Cancelled"
        }
      }
    },
    {
      "do": "pump",
      "expect": {
        "state": "Halted",
        "outcome": "refusal:Cancelled",
        "queue": []
      }
    }
  ]
}
