{
  "format": "scenario/0",
  "machine": "agent_step",
  "name": "no answer in the term: the pump makes the failure Timeout, the step is refused, the request is cancelled",
  "start_at": 1000,
  "steps": [
    {"do": "feed", "event": {"kind": "start", "request": "call-1", "input": {"agent_request": {"$record": "AgentRequest", "fields": {"kind": {"$variant": "CallerKind", "name": "CycleSession", "fields": {}}, "profile": {"$record": "AgentProfile", "fields": {"family": "claude", "model": "m1", "effort": null}}, "session": "s1", "dialog_kind": "main", "context": "ctx", "limits": {"$record": "AgentLimits", "fields": {"silence_term": 5000, "token_budget": null, "cost_budget": null, "turn_limit": null}}, "trace": "t1", "step": 0}}}}, "host": {"reply_validation": {"$variant": "ReplyCheck", "name": "Valid", "fields": {}}, "close_agent_turn": null}, "expect": {"state": "AgentTurn", "journal": [], "data": {"turn_count": 1, "started": 1000, "turn": "first", "agent_attempt": 1, "open_requests": ["agent-1"], "call_request_id": "call-1"}, "open": ["agent-1"], "sent": ["agent-1"]}},
    {"do": "advance", "ms": 4000},
    {"do": "pump", "expect": {"state": "AgentTurn", "open": ["agent-1"], "outcome": "none"}},
    {"do": "advance", "ms": 1001},
    {"do": "pump", "expect": {"state": "Halted", "journal": [{"code": "turn_failed", "params": {"reason": "timeout"}}, {"code": "agent_usage", "params": {"session": "s1", "result": "timeout", "model": "m1", "input": "none", "output": "none", "reasoning": "none", "cache_read": "none", "cache_write": "none", "cost": "none"}}, {"code": "agent_step_stopped", "params": {"reason": "timeout"}}], "open": [], "outcome": "refusal:Timeout", "cancelled": ["agent-1"]}}
  ]
}
