{
  "format": "scenario/0",
  "machine": "agent_step",
  "name": "the cancel of the request of the call, then the late answer is dropped",
  "start_at": 1000,
  "steps": [
    {"do": "feed", "event": {"kind": "start", "request": "call-1", "input": {"agent_request": {"$record": "AgentRequest", "fields": {"kind": {"$variant": "CallerKind", "name": "CycleSession", "fields": {}}, "profile": {"$record": "AgentProfile", "fields": {"family": "claude", "model": "m1", "effort": null}}, "session": "s1", "dialog_kind": "main", "context": "ctx", "limits": {"$record": "AgentLimits", "fields": {"silence_term": null, "token_budget": null, "cost_budget": null, "turn_limit": null}}, "trace": "t1", "step": 0}}}}, "host": {"reply_validation": {"$variant": "ReplyCheck", "name": "Valid", "fields": {}}, "close_agent_turn": null}, "expect": {"state": "AgentTurn", "journal": [], "data": {"turn_count": 1, "started": 1000, "turn": "first", "agent_attempt": 1, "open_requests": ["agent-1"], "call_request_id": "call-1"}, "open": ["agent-1"], "sent": ["agent-1"]}},
    {"do": "feed", "event": {"kind": "signal", "name": "cancel_request", "input": "call-1"}, "expect": {"state": "Halted", "journal": [{"code": "request_cancelled", "params": {"request": "call-1", "event": "input-3"}}, {"code": "agent_usage", "params": {"session": "s1", "result": "cancel_request", "model": "m1", "input": "none", "output": "none", "reasoning": "none", "cache_read": "none", "cache_write": "none", "cost": "none"}}, {"code": "agent_step_stopped", "params": {"reason": "cancel_request"}}], "data": {"stop_reason": "cancel_request", "open_requests": []}, "open": [], "outcome": "refusal:Cancelled", "cancelled": ["agent-1"]}},
    {"do": "feed", "event": {"kind": "answer", "name": "agent_done", "request": "agent-1", "input": {"$variant": "TurnResult", "name": "Finished", "fields": {"text": "hello", "artifact": null, "usage": {"$record": "TransportUsage", "fields": {"model": {"$record": "AgentModel", "fields": {"id": "m1", "provider": "p", "variant": null}}, "tokens": {"$record": "TokenUsage", "fields": {"input": 10, "output": 5, "reasoning": null, "cache_read": null, "cache_write": null}}, "cost": null, "context_used": null, "request_started": 5}}}}}, "expect": {"state": "Halted", "journal": [], "outcome": "refusal:Cancelled"}}
  ]
}
