{
  "format": "scenario/0",
  "machine": "session_start",
  "name": "LAUNCH 2: the volume does not fit: the row 2 of SCOPE does not prepare the launch (B1 is shown, the poisoned answer of prepare_launch is not touched)",
  "start_at": 1000,
  "steps": [
    {
      "do": "feed",
      "host": {
        "reply_validation": {
          "$variant": "ReplyCheck",
          "name": "Valid",
          "fields": {}
        },
        "close_agent_turn": null,
        "launch_scope": {
          "$variant": "LaunchScope",
          "name": "DoesNotFit",
          "fields": {}
        },
        "launch_profile": {
          "$record": "AgentProfile",
          "fields": {
            "family": "claude",
            "model": "m1",
            "effort": null
          }
        },
        "session_context": "the prompt of s3",
        "parse_session_artifact": {
          "$record": "SessionParsing",
          "fields": {
            "result": {
              "$variant": "SessionResult",
              "name": "Done",
              "fields": {}
            },
            "summary": null,
            "findings": null
          }
        },
        "stop_agent_group": null,
        "prepare_launch": null,
        "finish_launch": null
      },
      "event": {
        "kind": "start",
        "request": "up-1",
        "input": {
          "session": "s3",
          "task_dir": "/t",
          "repo_dir": "/r",
          "delivery_mode": "files",
          "route": "full",
          "delivery_short": false
        }
      },
      "expect": {
        "state": "Gate2",
        "journal": [],
        "open": [],
        "sent": [],
        "queue": [],
        "outcome": "none",
        "data": {
          "call_request_id": "up-1",
          "step_attempt": 0,
          "open_requests": [],
          "session": "s3",
          "stop_reason": ""
        }
      }
    },
    {
      "do": "feed",
      "host": {
        "prepare_launch": 5
      },
      "event": {
        "kind": "signal",
        "name": "confirm"
      },
      "expect": {
        "state": "Gate1",
        "journal": [],
        "outcome": "none"
      }
    }
  ]
}
