{
  "format": "scenario/0",
  "machine": "DialogSession",
  "name": "a cancel in Idle is a note, nothing ends and nothing is cancelled",
  "start_at": 1000,
  "params": {"проект.срок_бездействия": 30000},
  "steps": [
    {"do": "feed", "event": {"kind": "word", "name": "cancel"}, "expect": {"state": "Idle", "journal": [{"code": "event_ignored", "params": {"event": "cancel", "state": "Idle"}}], "open": [], "sent": [], "cancelled": [], "outcome": "none"}},
    {"do": "feed", "event": {"kind": "word", "name": "user_message", "input": "hi"}, "expect": {"state": "Awaiting", "open": ["agent-1"]}}
  ]
}
