{
  "format": "scenario/0",
  "machine": "session_start",
  "name": "SCOPE 1: the volume fits -> SESSION: the request goes to the agent step with the session, and the nested machine asks its agent",
  "start_at": 1000,
  "steps": [
    {
      "do": "feed",
      "host": {
        "reply_validation": {
          "$variant": "ReplyCheck",
          "name": "Valid",
          "fields": {}
        },
        "close_agent_turn": null,
        "launch_scope": {
          "$variant": "LaunchScope",
          "name": "Fits",
          "fields": {}
        },
        "launch_profile": {
          "$record": "AgentProfile",
          "fields": {
            "family": "claude",
            "model": "m1",
            "effort": null
          }
        },
        "session_context": "the prompt of s1",
        "parse_session_artifact": {
          "$record": "SessionParsing",
          "fields": {
            "result": {
              "$variant": "SessionResult",
              "name": "Done",
              "fields": {}
            },
            "summary": null,
            "findings": null
          }
        },
        "stop_agent_group": null,
        "prepare_launch": null,
        "finish_launch": null
      },
      "event": {
        "kind": "start",
        "request": "up-1",
        "input": {
          "session": "s1",
          "task_dir": "/t",
          "repo_dir": "/r",
          "delivery_mode": "files",
          "route": "full",
          "delivery_short": false
        }
      },
      "expect": {
        "state": "Gate2",
        "journal": [],
        "open": [],
        "sent": [],
        "queue": [],
        "outcome": "none",
        "data": {
          "call_request_id": "up-1",
          "step_attempt": 0,
          "open_requests": [],
          "session": "s1",
          "stop_reason": ""
        }
      }
    },
    {
      "do": "feed",
      "event": {
        "kind": "signal",
        "name": "confirm"
      },
      "expect": {
        "state": "Session",
        "open": [
          "agent_step-1"
        ],
        "sent": [
          "agent_step-1"
        ],
        "outcome": "none",
        "data": {
          "step_attempt": 1,
          "open_requests": [
            "agent_step-1"
          ]
        }
      },
      "also": {
        "agent_step-1": {
          "state": "AgentTurn",
          "open": [
            "agent-1"
          ],
          "sent": [
            "agent-1"
          ],
          "outcome": "none",
          "data": {
            "call_request_id": "agent_step-1",
            "open_requests": [
              "agent-1"
            ]
          }
        }
      }
    }
  ]
}
