{
  "format": "scenario/0",
  "machine": "agent_step",
  "name": "the process dies between the commit and the send: the restart sends the request once",
  "start_at": 1000,
  "steps": [
    {"do": "accept", "event": {"kind": "start", "request": "call-1", "input": {"agent_request": {"$record": "AgentRequest", "fields": {"kind": {"$variant": "CallerKind", "name": "CycleSession", "fields": {}}, "profile": {"$record": "AgentProfile", "fields": {"family": "claude", "model": "m1", "effort": null}}, "session": "s1", "dialog_kind": "main", "context": "ctx", "limits": {"$record": "AgentLimits", "fields": {"silence_term": null, "token_budget": null, "cost_budget": null, "turn_limit": null}}, "trace": "t1", "step": 0}}}}, "host": {"reply_validation": {"$variant": "ReplyCheck", "name": "Valid", "fields": {}}, "close_agent_turn": null}, "expect": {"state": "AgentTurn", "queue": ["send agent-1"], "open": ["agent-1"], "sent": []}},
    {"do": "restart", "expect": {"state": "AgentTurn", "sent": []}},
    {"do": "dispatch", "expect": {"queue": [], "sent": ["agent-1"]}},
    {"do": "dispatch", "expect": {"sent": ["agent-1"]}},
    {"do": "feed", "event": {"kind": "answer", "name": "agent_done", "request": "agent-1", "input": {"$variant": "TurnResult", "name": "Finished", "fields": {"text": "hello", "artifact": null, "usage": {"$record": "TransportUsage", "fields": {"model": {"$record": "AgentModel", "fields": {"id": "m1", "provider": "p", "variant": null}}, "tokens": {"$record": "TokenUsage", "fields": {"input": 10, "output": 5, "reasoning": null, "cache_read": null, "cache_write": null}}, "cost": null, "context_used": null, "request_started": 5}}}}}, "expect": {"state": "End", "journal": [{"code": "agent_usage", "params": {"session": "s1", "result": "reply", "model": "m1", "input": "10", "output": "5", "reasoning": "none", "cache_read": "none", "cache_write": "none", "cost": "none"}}]}}
  ]
}
