{
  "format": "scenario/0",
  "machine": "agent_step",
  "name": "HALTED 6: the stop reason max_tokens is a refusal MaxTokens",
  "start_at": 1000,
  "steps": [
    {"do": "feed", "event": {"kind": "start", "request": "call-1", "input": {"agent_request": {"$record": "AgentRequest", "fields": {"kind": {"$variant": "CallerKind", "name": "CycleSession", "fields": {}}, "profile": {"$record": "AgentProfile", "fields": {"family": "claude", "model": "m1", "effort": null}}, "session": "s1", "dialog_kind": "main", "context": "ctx", "limits": {"$record": "AgentLimits", "fields": {"silence_term": null, "token_budget": null, "cost_budget": null, "turn_limit": null}}, "trace": "t1", "step": 0}}}}, "host": {"reply_validation": {"$variant": "ReplyCheck", "name": "Valid", "fields": {}}, "close_agent_turn": null}, "expect": {"state": "AgentTurn", "journal": [], "data": {"turn_count": 1, "started": 1000, "turn": "first", "agent_attempt": 1, "open_requests": ["agent-1"], "call_request_id": "call-1"}, "open": ["agent-1"], "sent": ["agent-1"]}},
    {"do": "feed", "event": {"kind": "answer", "name": "agent_done", "request": "agent-1", "input": {"$variant": "TurnResult", "name": "Truncated", "fields": {"usage": {"$record": "TransportUsage", "fields": {"model": {"$record": "AgentModel", "fields": {"id": "m1", "provider": "p", "variant": null}}, "tokens": {"$record": "TokenUsage", "fields": {"input": 10, "output": 5, "reasoning": null, "cache_read": null, "cache_write": null}}, "cost": null, "context_used": null, "request_started": 5}}}}}, "expect": {"state": "AgentTurn"}},
    {"do": "feed", "event": {"kind": "answer", "name": "agent_done", "request": "agent-2", "input": {"$variant": "TurnResult", "name": "Truncated", "fields": {"usage": {"$record": "TransportUsage", "fields": {"model": {"$record": "AgentModel", "fields": {"id": "m1", "provider": "p", "variant": null}}, "tokens": {"$record": "TokenUsage", "fields": {"input": 10, "output": 5, "reasoning": null, "cache_read": null, "cache_write": null}}, "cost": null, "context_used": null, "request_started": 5}}}}}, "expect": {"state": "Halted", "journal": [{"code": "output_truncated_again"}, {"code": "agent_usage", "params": {"session": "s1", "result": "max_tokens", "model": "m1", "input": "20", "output": "10", "reasoning": "none", "cache_read": "none", "cache_write": "none", "cost": "none"}}, {"code": "agent_step_stopped", "params": {"reason": "max_tokens"}}], "data": {"continuation_count": 1, "stop_reason": "max_tokens"}, "open": [], "outcome": "refusal:MaxTokens"}}
  ]
}
